{
  "schema_version": 1,
  "version": "2026.10.14",
  "updated_at": "2026-10-14",
  "repository": "https://github.com/manishiitg/free-agent-tools",
  "freshness_days": 30,
  "categories": [
    {
      "id": "search",
      "name": "Search & research"
    },
    {
      "id": "scraping",
      "name": "Scraping & extraction"
    },
    {
      "id": "browser",
      "name": "Browser automation"
    },
    {
      "id": "inference",
      "name": "Model inference"
    },
    {
      "id": "speech",
      "name": "Speech & voice"
    },
    {
      "id": "realtime",
      "name": "Realtime audio & video"
    },
    {
      "id": "media",
      "name": "Image & video generation"
    },
    {
      "id": "documents",
      "name": "Document parsing & OCR"
    },
    {
      "id": "rendering",
      "name": "Screenshots, PDFs & rendering"
    },
    {
      "id": "compute",
      "name": "Sandboxes & compute"
    },
    {
      "id": "memory",
      "name": "Agent memory"
    },
    {
      "id": "vector",
      "name": "Embeddings & vector databases"
    },
    {
      "id": "integrations",
      "name": "App integrations & auth"
    },
    {
      "id": "email",
      "name": "Email"
    },
    {
      "id": "enrichment",
      "name": "Data enrichment"
    },
    {
      "id": "observability",
      "name": "Tracing & evaluation"
    },
    {
      "id": "translation",
      "name": "Translation"
    },
    {
      "id": "maps",
      "name": "Maps & geocoding"
    },
    {
      "id": "weather",
      "name": "Weather"
    },
    {
      "id": "finance",
      "name": "Financial data"
    },
    {
      "id": "storage",
      "name": "Object storage"
    },
    {
      "id": "databases",
      "name": "Databases & cache"
    },
    {
      "id": "developer",
      "name": "Developer tools"
    },
    {
      "id": "business",
      "name": "Business APIs"
    }
  ],
  "providers": [
    {
      "id": "agentql",
      "name": "AgentQL",
      "categories": [
        "browser"
      ],
      "description": "AgentQL: browser extraction.",
      "capabilities": [
        "browser",
        "extraction"
      ],
      "api_access": true,
      "offer": {
        "kind": "recurring",
        "summary": "50 API calls per month; separate 300-call trial",
        "conditions": [
          "Remote-browser hours are a separate allowance."
        ]
      },
      "sources": [
        {
          "url": "https://www.agentql.com/pricing",
          "type": "official",
          "purpose": "pricing and eligibility"
        }
      ],
      "last_verified": "2026-10-11",
      "last_reviewed": "2026-10-11",
      "status": "verified",
      "mcp": {
        "support": "unknown",
        "setup_url": null,
        "agentworks_connector": null
      }
    },
    {
      "id": "airtable",
      "name": "Airtable",
      "categories": [
        "business",
        "databases"
      ],
      "description": "Tabular business data with a REST API for record and schema operations.",
      "capabilities": [
        "tables",
        "records",
        "database",
        "business",
        "automation",
        "rest"
      ],
      "api_access": true,
      "offer": {
        "kind": "recurring",
        "summary": "1,000 API calls per workspace per calendar month on Free",
        "conditions": [
          "Requires an Airtable account and authorized token. Rate limit is 5 requests per second per base, plus 50 per second across a token owner.",
          "Monthly limits reset on the first day of the month. After a one-time 30-day grace period, over-limit calls are blocked until reset.",
          "This is an API-call allowance; record, storage and automation limits are separate. Payment-card requirements are not stated in the reviewed API-limit documentation."
        ]
      },
      "sources": [
        {
          "url": "https://support.airtable.com/articles/7735693959-managing-api-call-limits-in-airtable",
          "type": "official",
          "purpose": "pricing and eligibility"
        }
      ],
      "last_verified": "2026-10-14",
      "last_reviewed": "2026-10-14",
      "status": "verified",
      "mcp": {
        "support": "unknown",
        "setup_url": null,
        "agentworks_connector": null
      }
    },
    {
      "id": "airtop",
      "name": "Airtop",
      "categories": [
        "browser"
      ],
      "description": "Airtop: browser automation agents.",
      "capabilities": [
        "browser",
        "automation",
        "agents"
      ],
      "api_access": true,
      "offer": {
        "kind": "unconfirmed",
        "summary": "Free plan lists 1,000 credits plus a 10,000-credit one-time bonus",
        "conditions": [
          "Includes 3 simultaneous sessions and 1 deployed agent; the 10,000-credit bonus is explicitly one-time.",
          "The separate Mark trial lasts 7 days or until credits are consumed. Reset and expiry of the base API credits are not explicitly stated."
        ]
      },
      "sources": [
        {
          "url": "https://www.airtop.ai/pricing",
          "type": "official",
          "purpose": "pricing and eligibility"
        }
      ],
      "last_verified": null,
      "last_reviewed": "2026-10-14",
      "status": "needs_review",
      "mcp": {
        "support": "unknown",
        "setup_url": null,
        "agentworks_connector": null
      }
    },
    {
      "id": "alpha-vantage",
      "name": "Alpha Vantage",
      "categories": [
        "finance"
      ],
      "description": "Alpha Vantage: financial data market.",
      "capabilities": [
        "financial",
        "data",
        "market"
      ],
      "api_access": true,
      "offer": {
        "kind": "recurring",
        "summary": "25 requests per day for most datasets",
        "conditions": [
          "Premium data and commercial licensing vary by endpoint."
        ]
      },
      "sources": [
        {
          "url": "https://www.alphavantage.co/support/",
          "type": "official",
          "purpose": "pricing and eligibility"
        }
      ],
      "last_verified": "2026-10-11",
      "last_reviewed": "2026-10-11",
      "status": "verified",
      "mcp": {
        "support": "unknown",
        "setup_url": null,
        "agentworks_connector": null
      }
    },
    {
      "id": "anchor-browser",
      "name": "Anchor Browser",
      "categories": [
        "browser"
      ],
      "description": "Anchor Browser: browser automation agents.",
      "capabilities": [
        "browser",
        "automation",
        "agents"
      ],
      "api_access": true,
      "offer": {
        "kind": "recurring",
        "summary": "5 credits per month",
        "conditions": [
          "Task and session limits differ; check detailed operation pricing."
        ]
      },
      "sources": [
        {
          "url": "https://anchorbrowser.io/",
          "type": "official",
          "purpose": "pricing and eligibility"
        }
      ],
      "last_verified": "2026-10-11",
      "last_reviewed": "2026-10-11",
      "status": "verified",
      "mcp": {
        "support": "unknown",
        "setup_url": null,
        "agentworks_connector": null
      }
    },
    {
      "id": "apify",
      "name": "Apify",
      "categories": [
        "scraping"
      ],
      "description": "Apify: scrape automation datasets.",
      "capabilities": [
        "scrape",
        "automation",
        "datasets"
      ],
      "api_access": true,
      "offer": {
        "kind": "recurring",
        "summary": "$5 platform usage per month",
        "conditions": [
          "Actor-specific fees and compute consumption can both apply."
        ]
      },
      "sources": [
        {
          "url": "https://apify.com/pricing",
          "type": "official",
          "purpose": "pricing and eligibility"
        }
      ],
      "last_verified": "2026-10-11",
      "last_reviewed": "2026-10-11",
      "status": "verified",
      "mcp": {
        "support": "unknown",
        "setup_url": null,
        "agentworks_connector": "Apify"
      }
    },
    {
      "id": "arcade",
      "name": "Arcade",
      "categories": [
        "integrations"
      ],
      "description": "Arcade: app integrations auth tools.",
      "capabilities": [
        "app",
        "integrations",
        "auth",
        "tools"
      ],
      "api_access": true,
      "offer": {
        "kind": "recurring",
        "summary": "2,000 auth events and 2,000 tool calls per month",
        "conditions": [
          "No card required; underlying service costs and permissions are separate."
        ]
      },
      "sources": [
        {
          "url": "https://www.arcade.dev/pricing/",
          "type": "official",
          "purpose": "pricing and eligibility"
        }
      ],
      "last_verified": "2026-10-11",
      "last_reviewed": "2026-10-11",
      "status": "verified",
      "mcp": {
        "support": "unknown",
        "setup_url": null,
        "agentworks_connector": null
      }
    },
    {
      "id": "assemblyai",
      "name": "AssemblyAI",
      "categories": [
        "speech"
      ],
      "description": "AssemblyAI: transcription speech streaming audio speech-to-text.",
      "capabilities": [
        "transcription",
        "speech",
        "streaming",
        "audio",
        "speech-to-text"
      ],
      "api_access": true,
      "offer": {
        "kind": "trial",
        "summary": "$50 trial credits",
        "conditions": [
          "Upgrade after trial credits are consumed; verify streaming eligibility."
        ]
      },
      "sources": [
        {
          "url": "https://support.assemblyai.com/articles/5370767329-can-i-sign-up-for-free",
          "type": "official",
          "purpose": "pricing and eligibility"
        }
      ],
      "last_verified": "2026-10-11",
      "last_reviewed": "2026-10-11",
      "status": "verified",
      "mcp": {
        "support": "unknown",